tcpdump -c 5 -i eth0

tcpdump: verbose output suppressed, use -v[v]... for full protocol decode
listening on eth0, link-type EN10MB (Ethernet), snapshot length 262144 bytes
08:53:43.396702 IP lamponubuntu2204-s-1vcpu-1gb-tor1-01.ssh > 162.243.190.66.43816: Flags [P.], seq 2644580022:2644580150, ack 426583115, win 501, options [nop,nop,TS val 3695178083 ecr 2783350148], length 128
08:53:43.396781 IP lamponubuntu2204-s-1vcpu-1gb-tor1-01.ssh > 162.243.190.66.43816: Flags [P.], seq 128:192, ack 1, win 501, options [nop,nop,TS val 3695178083 ecr 2783350148], length 64
08:53:43.396806 IP lamponubuntu2204-s-1vcpu-1gb-tor1-01.ssh > 162.243.190.66.43816: Flags [P.], seq 192:272, ack 1, win 501, options [nop,nop,TS val 3695178083 ecr 2783350148], length 80
08:53:43.396855 IP lamponubuntu2204-s-1vcpu-1gb-tor1-01.ssh > 162.243.190.66.43816: Flags [P.], seq 272:352, ack 1, win 501, options [nop,nop,TS val 3695178083 ecr 2783350148], length 80
08:53:43.396894 IP lamponubuntu2204-s-1vcpu-1gb-tor1-01.ssh > 162.243.190.66.43816: Flags [P.], seq 352:432, ack 1, win 501, options [nop,nop,TS val 3695178083 ecr 2783350148], length 80
5 packets captured
48 packets received by filter
0 packets dropped by kernel